Title,Likes,Singer,Lyrics
Loop,764,g0nny (거니),"어느새 닫혀버린
문만 바라보는 강아지가 된 것 같아
내가 좀 달라진 건지
넌 아니라 해도
You're not coming this home
with me tonight
그 겨울 옆자리
처음 본 그 술자리
눈을 맞추고 내게 말하던 그때
우리 그때처럼 돌아갈 수 있을지
Maybe maybe maybe maybe
Maybe maybe
We go round and
round and round
Round and round
and round in the past
멀어지는
그 많은 약속들에 담은 바람들은
All in the past
사라지네
You already know
You already know
You already know
어느새 열리지 않는
맘을 기다리는 건 이제
혼자 만의 아픔인데
If I try for you
If I try for you
이런 저런 생각에
잠 못 이루던 날들
그 여름 하늘에
쏟아지는 별빛
눈을 맞추고 내게 말하던 그때
우리 그때처럼 돌아갈 수 있을지
Maybe maybe maybe maybe
Maybe maybe
We go round and
round and round
Round and round
and round in the past
멀어지는
그 많은 약속들에 담은 바람들은
All in the past
사라지네
Go round and
round and round and
Round and round
and round and
Round in the past
멀어지는
그 많은 약속들에 담은 바람들은
All in the past
사라지네
You already know
We already know
We already know
our love is done"
Catchew Me,367,김필선,"오 버려진 도시
호흡은 불결이고 사랑은 사탄이라는
도시의 Midnight 난 다시
재부팅된 거리를 기어가네
난 하이에나 아니면 삵
고양이라고 하지 마
그런 애들 손을 난 물어버릴 거야
그냥 앙 아니면 야옹
그들은 날 귀엽게 보겠지만
Fuck up Billy 먹이를 주지 마
난 거리의 사냥꾼
이건 인심을 써주는 거야
그냥 먹어줄 게
너의 Tuna 아니면 Gum
Chewing도 아닌 게 왜 이리 달콤해
Why meow
미안한데 가지든가
아님 떠나든가
네가 귀엽다며 나 좀 예쁘다며
그런 주제에 나 먹은 생선이 아깝니
Oh stupid I hate you
그러든지 말든지
난 별로 상관없거든
Fuck up Billy 먹이를 주지 마
난 거리의 사냥꾼
이건 인심을 써주는 거야
특별히 먹어줄 게
너의 Tuna 아니면 Gum
Chewing도 아닌 게
왜 이리 달콤해 Why
음 그대로 등 돌려서 가라
난 다시 상처받기 싫은걸
이렇게 사는 게 좋은걸
난 거리의 사냥꾼 meow meow
난 거리의 사냥꾼 meow meow
사실은 널 사랑하는 meow meow
Oh I love you Billy
Meow meow memememeow"
Good Night,"9,971",김민석,"잠들 때쯤 넌 내 머릿속에
항상 찾아왔었지
늘 다르게 한결같이
예쁘게 있었지
널 생각할 때면 넋 나간 채로
몇십분은 순간이 됐고
그렇게 넌 별처럼 내 밤을 채웠지
난 항상 all night
널 그려 all night
I wanna spend my
all night with you
넌 나의 good night
널 꿈꿔 all night
I wanna spend
my lifetime with you
너와의 사랑을 그리워하다
잠이 들 때면
가끔 내 꿈 속의 내게
입맞춰주던 너
나에게 나타나준 밤에
어떤 아픈 밤도 황홀한 밤으로
선물을 해준 너
난 항상 all night
널 그려 all night
I wanna spend my
all night with you
넌 나의 good night
널 꿈꿔 all night
I wanna spend
my lifetime with you
너를 그리다가 내가 잠이 들 땐
나의 꿈을 물들이던 너
나에게 다가오는 그 밤을
황홀하게 해줄래
난 항상 all night
널 그려 all night
I wanna spend my
all night with you
넌 나의 good night
널 꿈꿔 all night
I wanna spend
my lifetime with you
나 혼자 널 그리워하다
깊이 잠이 드는 밤"
Beautiful Night,"2,600",Seori,"잠시만 아무 말 하지 말고
다른 생각들은 멀리 놔둬요
도시의 물든 뒤섞인 마음
여기 다 던져두고
없던 일처럼 다 묻어둬요
여기 누워봐
지금이 딱 좋아 좋아
이 분위기에 녹아 녹아
눈부시게 빛나는 별빛과
적당한 온도의 바람
아직도 무슨 생각 하나요
얼굴에 써있어 내게 말해요
얼룩진 표정 복잡한 일들
곧 있을 별들의 축제에
아무런 필요 없는데
나를 믿어봐
지금이 딱 좋아 좋아
이 분위기에 녹아 녹아
눈부시게 빛나는 별빛과
적당한 온도의 바람
서툴렀던 지난 날과
잠 못 이루며 했던 걱정 모두
이 시간만큼 다 벗어 두자
지금 필요한 건
가벼운 마음 건강한 생각
약간의 알콜 그 뿐이야
너와 나의 오늘은
가장 빛이 날 내일
사랑으로 가득 찬
It's a Beautiful Night
너와 나의 오늘은
가장 빛이 날 내일
사랑으로 가득 찬
It's a Beautiful Night"
Ferrari,"1,276",40,"모질게 뱉어버린 말
와르르 쏟아내고
말들은 엎질러진 물처럼
종종 그대 곁을 자꾸 흘러내리곤 했다
should we just buy a ferrari
and drive along the coast
다툼은 그저 우릴 스칠 뿐이에요
should we just buy a ferrari
and drive along the coast
괜찮아요 젖은 셔츠
잠시 마르게 내버려 둬요
서로의 얼굴을 보면서
우린 그렇게 미소를 띠겠지
언제 그랬냐며
그대 내게 입 맞춰 줄 거야
should we just buy a ferrari
and drive along the coast
다툼은 그저 우릴 스칠 뿐이에요
should we just buy a ferrari
and drive along the coast
괜찮아요 젖은 셔츠
잠시 마르게 내버려 둬요
그렇게 우린 잠이 들고
소리 없이 새벽은 잠시 왔다가
영원할 것 같던 오늘이 찾아와
우리의 사랑, 이 숨결
영원할 수 없다는 거 잘 알잖아
should we just buy a ferrari
and drive along the coast
다툼은 그저 우릴 스칠 뿐이에요
should we just buy a ferrari
and drive along the coast
괜찮아요 젖은 셔츠
잠시 마르게 내버려 둬요"
인 영,407,구름,"눈이 부을 만큼 많이 울었나 보다
입을 벌리고 잔 듯 얼룩이 남았구나

언젠가 너의 그림자 아래 누워서 혼자 잠이 들었나 보다
오랜 시간 깨지 못해도 너 하나만은

당연한 듯 나타나 나를 베어 물어서
지금까지 모든 것이 꿈이었다고 말해줘
밤새 울던 기억 전부 없던 거라고 내게

눈을 뜨고 나면은 손을 잡아 올려서
깨어나지 않을 줄 알고 무서웠다고 말해줘
나의 모든 과거에 네가 있었다고, 날 안아줘

대체 여긴 몇 겹의 나쁜 꿈일까, 기억나지 않는 관계들
같은 실수를 반복해도 너 하나만은

당연한 듯 나타나 나를 베어 물어서
지금까지 모든 것이 꿈이었다고 말해줘
밤새 울던 기억 전부 없던 거라고 내게

눈을 뜨고 나면은 손을 잡아 올려서
깨어나지 않을 줄 알고 무서웠다고 말해줘
나의 모든 과거에 네가 있었다고, 날 안아줘"
Lonely Girl Boys Club,42,songseoul,"그대 오늘도 떠남 뒤에 오지 않는 잠 이루고
새로운 만남에 겁이 나 그댈 더 감추죠
I don't need love
이젠 상처받고 싶지 않아
I don't meet no one
더 이상 괜찮단 말 따윈 믿고 싶지도 않아
그럴 땐 여기 이상한 클럽에
널 닮은 애들 모인
계속 흔드네 머릴 또
Bluelight
누구 하나
말 한마디 없는 밤
기울이는 잔
무대 윈 적막해
여기 Lonely Girl Boys Club엔
Lonely Girl Boys Club에
한마디 말 건네지도 않네
여기로 Lonely Girl Boys Club에
더 밑으로 dive
우리 머리 위
가득 드리운 후회 떨쳐 버리게
모두 떠난 뒤
길거리 위를 떠도는 그대들을 위해
또는 외로이 남겨진 관계 뒤 공백들을 위해
Lonely Girl Boys Club에
Come with no love all day
그대 오늘도 뻔한 이별에 할 일을 미루고
외로운 만남에 지친 밤 혼자 웃고 울죠
I don't need love
이젠 떠나고 싶지 않아
I don't meet no one
더 이상 괜찮냔 말 따윈 필요하지도 않아
그럴 땐 여기 이상한 클럽에
널 닮은 애들 모인
계속 흔드네 머릴 또
Bluelight
누구 하나
말 한마디 없는 밤
기울이는 잔
무대 윈 적막해
여기 Lonely Girl Boys Club엔
Lonely Girl Boys Club에
한마디 말 건네지도 않네
여기로 Lonely Girl Boys Club에
더 밑으로 dive
우리 머리 위
가득 드리운 후회 떨쳐 버리게
모두 떠난 뒤
길거리 위를 떠도는 그대들을 위해
또는 외로이 남겨진 관계 뒤 공백들을 위해
Lonely Girl Boys Club에
Come with no love all day
불이 꺼진 뒤
가득했던 사람들은 어디에
감쪽같이 같은 처지인 척하던 이들은 거리에
나가 새로운 사랑을 품고
나만 혼자서 줄곧
Lonely Girl Boys Club에
Only alone club에"
Gloria,"15,713",나얼,"Gloria
My Gloria
Things ain’t been the same
Since you went away
Gloria
My Gloria
I don’t want to see
Another day
It seems like
Only yesterday
I beheld your sweet face
And In my lonely room
My memories of your embrace
Gloria
My Gloria
Things ain’t been the same
Since you went away
Gloria
My Gloria
I don’t want to see
Another day
Isn’t it funny
How time can change
All the things you want to believe
But time won’t change
The way I feel
Cause in my mind
It’s you and me
You and me
Gloria
My Gloria
Things ain’t been the same
Since you went away
I just can’t go on
Gloria
My Gloria
I don’t want to see
Another day
So lonely girl
Isn’t it funny
How time can change
All the things you want to believe
But time won’t change
The way I feel
Cause in my mind
It’s still you and me
You and me
Gloria
My Gloria
Things ain’t been the same
Since you went away
I just can’t go on
Gloria
My Gloria
I don’t want to see
Another day
I don’t want to see another day
Without your lover
I don’t want to see another day
It’s a real sad thing
But I don’t want to see
Without your lover
I don’t want to see another day
It’s gonna hurt me
But I don’t want to see
another day
I just think no way
No longer
Another day
I don’t want to see
I just can’t let her be
I still love
I don’t want to see
Can’t you hear me
Another day
I don’t want to see"
home dance,"3,870",선재 (snzae),"too many thoughts in my head
who cares me nobody
나만 눈을 감고 있나 봐
그 정반대일 수도
make me stand up
I know what I have to do but
몸이 굳은 건 내 머리 탓인가
I know what I have to do but
사람이 너무 많아서 그럴 거야
middle of the hall 나만 자꾸
힘들어져 아무나 옆으로
join with me 조용히
come here and dance with me
차분히
would you dance with me
home dance
I’m in my home yeah
home dance
don’t take me out
나의 세상에서
who cares me
어차피 nobody
I’m in my home
괜찮아 눈만 안 뜨면
움직여 home dancing
I’m in my room babe
party in my head
저 밖은 나랑 안 어울려
움직여 home dancing
I’m in my room babe
party in my head
저 밖은 나랑 안 어울려
여기가 밖일 수도
좀 더 깊이로
who cares about me
about me
would you dance with me
home dance
I’m in my home yeah
home dance
don’t take me out
나의 세상에서
who cares me
어차피 nobody
I’m in my home
괜찮아 눈만 안 뜨면
움직여 home dancing
I’m in my room babe
party in my head
저 밖은 나랑 안 어울려
움직여 home dancing
I’m in my room babe
party in my head
저 밖은 나랑 안 어울려"
Sometimes,712,네이비쿼카 (NavyQuokka),"오늘 하루는 온종일 맑다는데
나만 여기 혼자 흐린 것 같아
다들 걱정 없이 웃는 것 같아
어제 하늘은 온종일 울었는데
아무 걱정 없이 맑은 것 같아
나만 여기 혼자 있는 것 같은
나 이런 기분에 질 때면
안아주는 너라는 사람을 만나서
행복한 감정을 느껴도 될까
부족한 나라도 괜찮은 걸까
어쩌면 이런 걸 사랑이라 할까
가끔 아무것도
하고 싶지 않을 때가 있어
그럴 때마다 나를 그냥
두지 말고 옆에 있어줘
가끔 아무것도 아닌 거 같다는
상상이 들 때마다
귀찮게 해줘 날 못살게 굴어줘
이제 네게 보여줄게
Oh love I wanna be your love
Oh love love
어제 하늘은 온종일 울었는데
아무 걱정 없이 맑은 것 같아
나만 여기 혼자 있는 것 같은
오늘 하루는 온종일 맑다는데
나만 여기 혼자 흐린 것 같아
다들 걱정 없이 웃는 것 같아
나 이런 기분에 질 때면
안아주는 너라는 사람을 만나서
행복한 감정을 느껴도 될까
부족한 나라도 괜찮은 걸까
어쩌면 이런 걸 사랑이라 할까
가끔 아무것도
하고 싶지 않을 때가 있어
그럴 때마다 나를 그냥
두지 말고 옆에 있어줘
가끔 아무것도 아닌 거 같다는
상상이 들 때마다
귀찮게 해줘 날 못살게 굴어줘
이제 네게 보여줄게
Oh love I wanna be your love
Oh love love
Love I wanna be your love
Oh love love"
많이 사랑했었고 미안해,164,손준혁,"널 만난 시간이 너무 짧게 느껴져
너무 갑작스럽게 찾아온 이별

어떻게든 난
잘 지내보려 해 너 없이도
불안한 마음에 널 다그치고
힘들었을 널 안아줬다면 그날

많이 좋아했었고 미안해
잘 지내란 말 하지 않을래
많이 사랑했었고 미안해
이렇게밖에 할 수 없는 나라서

어떻게든 난
잘 지내보려 해 너 없이도
불안한 마음에 널 다그치고
힘들었을 널 안아줬다면 그날

많이 좋아했었고 미안해
잘 지내란 말 하지 않을래
많이 사랑했었고 미안해
이렇게밖에 할 수 없는 나라서

사랑한 만큼 아플 것 같아
이젠 서로의 마음에 묻어두고

많이 좋아해 줘서 고마워
아직도 나의 마음엔
사랑한 기억만 남아
많이 사랑해 줘서 고마워
잊지 않을게
너무 사랑한 우리"
cat and mouse (feat. 전예찬),26,루카스 (Lucas),"헷갈리게 하지 마
Baby close to me
자꾸 반응하잖아
Just feel so high feel so high
애태우려 하지 마
Baby come to me
너도 날 원하잖아
I know you girl know you girl

언제 올지 모를 답장을 기다리다
지쳐 먼저 전화를 걸어
웃으며 미안하단 너의 말에
우린 또 몇 시간 동안 통화를 해

Oh 네 맘을 모르겠어 난
I’m waiting for you
더 달콤하게 속삭여 제발 날 혼자 두지 마
Yeah eh

헷갈리게 하지 마
Baby close to me
자꾸 반응하잖아
Just feel so high feel so high
애태우려 하지 마
Baby come to me
너도 날 원하잖아
I know you girl know you girl

Don’t play with me
Don’t play cat and mouse
Don’t play with me
La la la La la la

Don’t play with me
Don’t play cat and mouse
Don’t play with me
La la la La la la

Oh 솔직하게 말해 이젠
I know you want me too
더 달콤하게 속삭여 내 심장 견딜 수 없게
Yeah eh

헷갈리게 하지 마
Baby close to me
자꾸 반응하잖아
Just feel so high feel so high
애태우려 하지 마
Baby come to me
너도 날 원하잖아
I know you girl know you girl

Don’t play with me
Don’t play cat and mouse
Don’t play with me
La la la La la la

Don’t play with me
Don’t play cat and mouse
Don’t play with me
La la la La la la"
기다리다 미쳐,"3,379",빅마마,"아파도 아파도 아파도 널 기다려
내 사랑 너 하나 뿐이니까
슬퍼도 슬퍼도 슬퍼도 널 기다려
내 사랑 변하지 않으니까
I'm Wating For You 널 기다릴께
다시 지겨운 사랑의 연속이여도
I'm Wating For You
상처 투성인 가슴이
너를 원하고 또 원하니까
기다리다 미쳐 너 기다리다 지쳐
나 슬픔안에 갇혀 상처 만을
내게 남기고 기다리다 미쳐
사랑하다 지쳐버린 내게 돌아 와줘
다시 나에게로 다시 와
너 기다리다 미쳐
미워도 미워도 미워도 널 사랑해
사랑은 너 하나 뿐이니까
슬퍼도 슬퍼도 슬퍼도 널 기다려
내 사랑 변하지 않으니까
I'm Wating For You 널 기다릴게
다시 지겨운 사랑의 연속이여도
I'm Wating For You
눈물 투성인 가슴이
너를 바라고 또 바라니까
기다리다 미쳐 너 기다리다 지쳐
나 슬픔안에 갇혀 상처 만을
내게 남기고 기다리다 미쳐
사랑하다 지쳐버린 내게 돌아와줘
다시 나에게로 다시 와
너 기다리다 미쳐
You Make Me Cry 왜 날 울게해
다시 예전처럼 다시 날 안아줘
사랑하다 다쳐 이 마음 다 바쳐
바보같이 기다리면 니가 돌아올까
이러다가 놓쳐 또 좋은 사람 놓쳐
혹시 니가 후회 하면 다시 돌아올까
기다리다 미쳐 사랑하다 지쳐 버린
내게 돌아와줘 다시 나에게로 다시 와
너 기다리다 미쳐"
긴 밤,"9,174",OuiOui (위위),"어두워진 밤 어두워진 맘
구름에 가려진 달처럼 흐릿해진 맘
길어진 이 밤에 깊어진 생각에
생각에 생각이 가려져
알 수 없는 맘
선명하지가 않은 건
우리인 걸까 내 맘인 걸까
말할 수도 없어 헤매이다가
내 맘에 네 별을 헤는 밤
생각이 너무 많아서
잠드는 게 어려워서
난 over and over and over
Sometimes I wonder why
난 너무 외로운 걸
사라지지 않는 어둠 속에서
So I I need you now
변해가는 세상 속에서
변하지 않는 저 빛이 돼 줄래
잊혀지지 않는 게 참 많아
사소한 기억들까지 남아
가끔 눈물 흘리게
채워질 수 없는 맘을 알지만
문제없는 답을 찾고
기억을 맴돌고 있어
나도 잘 모르는 내 맘을
알아주길 바라는 내 맘이
참 이기적인 걸
난 다 아는 것처럼
생각이 너무 많아서
잠드는 게 어려워서
난 over and over and over
Sometimes I wonder why
난 너무 외로운 걸
사라지지 않는 어둠 속에서
So I I need you now
변해가는 세상 속에서
변하지 않는 저 빛이 돼 줄래
You
You are my moonlight
You are my moonlight
You are my moonlight"
사이,"15,928",CIKI,"청소년 보호법에 따라 성인 인증이 필요한 콘텐츠 입니다. 성인 인증 후 이용해 주세요.
성인 인증"
누가 그런 말을 했을까,"5,183",이강승,"작은 위로를 건네주던 밤
그다음은 어디로 갔을까
사라지는 줄만 알았던
우리 마음은 그대로일까
두 손에 꽉 쥐고 있던 게
내 모습이 아니었을까
떠나갈까 두려워했던
나를 두고 여길 떠날게
무슨 말이라도 난 좋아
주저하는 그대 몸짓과
이루어질 여기 모든 게
나름 웃음 짓게 해
오늘 아니라도 난 좋아
내일이면 웃을 그대와
이루어질 여기 모든 게
나름 웃음 짓게 해
나를 위로한 건 아마
어제와 어제 그래
비슷하게 느꼈을 거라
우린 알 거라면서
어려워만 했던 밤이
위로가 돼버렸을 때
지나버린 내 모든 게
의미가 없어졌네
무슨 말이라도 난 좋아
주저하는 그대 몸짓과
이루어질 여기 모든 게
나름 웃음 짓게 해
오늘 아니라도 난 좋아
내일이면 웃을 그대와
이루어질 여기 모든 게
나름 웃음 짓게 해
내가 잘못한 게 아닐 거야
네가 잘못해서 그럴 거야
누가 그런 말을 했던 거야
눈을 감고 여기 있을 거야
몰라 내가 그래 이런 거야
내가 잘못한 게 아닐 거야
누가 그런 말을 했던 거야
끝나도 가만히 있을 거야"
Days and Years,"16,446",SHINee (샤이니),"다투며 하루를 보내도
다음 날엔 전부 잊은 듯해
또 다정해져 우린 다 별거 아닌 듯이
가끔은 소리를 지르고
낡고 녹슨 시소를 타는 것처럼
삐걱거리기도 해 아주 잠깐

모든 그 순간이 완벽하진 않아도
Days and years days and years

봐 여기 있을 거야 난 네가 여기 있는 한
그건 당연하잖아
네가 나를 지켜줬듯이 나도 지켜줄게 널
앞으로도 영원히

나와 같이 Days and years
Loving you for days and years
지금같이 Days and years
Loving you for days and years

우리가 나눈 이 감정이
사랑이 전부는 아니겠지
그건 분명해 말로는 설명 못 해
가끔은 고집을 피우고
깨져버린 어항에 담긴 물처럼
서로를 서운하게 해 아주 잠깐

모든 그 순간이 대단하진 않아도
Days and years days and years

봐 여기 있을 거야 난 네가 여기 있는 한
그건 당연하잖아
네가 나를 지켜줬듯이 나도 지켜줄게 널
앞으로도 영원히

나와 같이 Days and years
Loving you for days and years
지금같이 Days and years
Loving you for days and years

We'll go get it in the morning
그토록 기다려왔던
빛나는 시간 속에 Eh eh
모든 것을 맡긴 채

손을 뻗으면 마치 닿을 것 같이
너무 아름다운 너
더 높이 더 멀리 갈 수 있게
손을 잡아줘 Oh oh

봐 변함없을 거야 난
네가 그랬으니까 네게 배웠으니까
네가 나를 지켜줬듯이 나도 지켜줄게 널
앞으로도 영원히

나와 같이 Days and years
Loving you for days and years
지금같이 Days and years
Loving you for days and years

(나와 같이 Days and years)
많은 일이 있었고 또 일어나겠지
(Loving you for Days and years)
크고 작은 모든 장면에
(지금같이 Days and years)
다행이야 내가 너와 함께라는 게
(Loving you for days and years)
해가 뜨지 않는 날까지

나와 같이 Days and years"
괜찮아,"1,642",결 (KYUL),"바람은 다시 불고
지쳐서 보는 하늘은 지겨워
천천히 가리키던
시침이 알리는 하루는 길어
요즘 난 여전히 예전 그때에게서
벗어나지 못해
난 생각을 넓히고 싶어
다시 일어나 보이고 싶어
우린 좀 더 괜찮아질 거야
다시 견뎌내야 할 테지만
우린 좋은 사람이 될 거야
그때 웃고서 추억할 거야
상상이 마주치던
손가락질은 두렵고 싫어
한때는 아름다웠던 모습이
과거가 된 게 무서워
이제 난 어떤 누구와 만나서
맘을 털어야 할지
참아내고 돌아와 말하고 싶어
다시 일어나 보이고 싶어
우린 좀 더 괜찮아질 거야
다시 견뎌내야 할 테지만
우린 좋은 사람이 될 거야
그때 웃고서 추억할 거야"
hate my home,"1,148",polar (폴라),"I made you my world,
my everything
Maybe I'm a sucka
for a happy ending
Since what we had changed
will I miss you at all?
Like a silhouette,
blown up in my head
I'd hesitate through
conversations when we fought
I.. guess that was my fault
Now, there's a space
Filled with white noise
and I'm all alone
So I hate my home
Just thinking about u
I know, I know,
there's barely no use
I know, I know,
I'm stuck with these empty feelings
This table, our bed,
one dim room
hate my home,
cause you went ghost
I hate my home
Pictures all torn
Threw out some more clothes
Suddenly we're strangers
when we started so close
I'm sorry, but what..
the hell was it for?
You can't blame me,
I can't blame you
Blame our pride
for not takin' any sides
All's.. fair in love and war
Now, there's a space
Filled with white noise
and I'm all alone
So I hate my home
Just thinking about u
I know, I know,
there's barely no use
I know, I know,
I'm stuck with these empty feelings
This table, our bed,
one dim room
hate my home,
cause you went ghost
I hate my home"
YOU AND I,811,GRAM,"도대체 왜 이럴까
매일같이 네 생각이 나 yeah
네가 없는 이 밤을
버티기 너무 어려운 것 같아 정말로
다음에 보잔 말이 아쉬워서
그때 기억 속의 네가 자꾸만 떠올라
바보처럼 아무것도 못해 girl
얼굴이라도 보고 얘기하고 싶어
이 밤 마지막이 가기 전
오늘 네게 할 말이 있어
숨겨왔던 나의 맘을 너에게
다 고백하고 싶어 이제부터
YOU AND I
YOU AND I
YOU AND I
I wanna love you closely
Girl, I wanna love you baby
어제 일처럼 느껴져
많진 않았지만
함께했던 시간들이 yeah yeah
꿈인 것만 같아
깨어나지 않고 싶어
나를 보며 미소 짓는 너
나는 말이야 알고 싶단 말이야
너도 나와 똑같은 생각하고 있는지
이다음부터 너와 어색해져도
미뤄놨었던 모든 걸 얘기하고 싶어
이 밤 마지막이 가기 전
오늘 네게 할 말이 있어
숨겼던 나의 맘을 너에게
다 고백하고 싶어 이제부터
YOU AND I
YOU AND I
YOU AND I
I wanna love you closely
Girl, I wanna love you baby
애초부터 너와 나의 관계
계속 어중간하다고 생각했었어 uh
이젠 말해야겠어
애매해지긴 싫어
더 이상 못 들은 척 넘기려 해도
떨리는 그 눈빛으로 girl 날
바라봐 줘 (baby)
비껴진 마음의 사이로
남이 된다 해도
예전부터 난 변함없어
You’re the one that I want
이 밤 마지막이 가기 전
오늘 네게 할 말이 있어
숨겼던 나의 맘을 너에게
다 고백하고 싶어 이제부터
YOU AND I
YOU AND I
YOU AND I
I wanna love you closely
Girl, I wanna love you baby
So I wanna know girl
너의 마음을 좀 더
알고 싶어"
