Title,Likes,Singer,Lyrics
Talk To Me,"26,944",Red Velvet (레드벨벳),"Na na na
Talk-talk to me
Talk-talk-talk to me
Na na na
Talk-talk to me
Talk-talk-talk to me
숨결마다 포근한 향기
새로운 세상 믿기지 않아
나를 감싼 핑크빛 온기
놀라운 환상 눈 뗄 수 없는 난
Ooh boy ooh boy 이 순간들이
Ooh boy ooh boy 꿈이 아니길
왜 넌 살며시 웃기만 하니
Ooh 난 더 알고 싶어
기다린 기다린 기다린 기다린
속삭임 Baby
눈부시게 다가와
Talk to me Talk to me
한 줄기 햇살처럼 사뿐히 사뿐히
Na na na
네 두 눈에 담긴 알고 싶은 비밀 다
따스하게 다가와
Talk to me Talk to me
둘만의 꿈결처럼 달콤히 달콤히
Na na na
네 품 안에 숨긴 사랑이란 얘기 다
Talk to me Talk to me yeah
Talk-talk to me
Talk-talk-talk to me
Talk to me Boy
모든 걸 다 말해줘 Na na na
Oh 나 조심스레
두 발을 뗀 여긴 어딘지
어린아이처럼 호기심 가득한 채
너를 바라보고만 있지
낯선 감정 속에 헤매지 않게
천천히 하나 둘씩
내게 알려주겠니
내 심장을 두드린 여린 빛
하나까지 놓치기 싫은 걸
기다린 기다린 기다린 기다린
설레임 Come on baby now
눈부시게 다가와
Talk to me Talk to me
한 줄기 햇살처럼 사뿐히 사뿐히
Na na na
네 두 눈에 담긴 알고 싶은 비밀 다
따스하게 다가와
Talk to me Talk to me
둘만의 꿈결처럼 달콤히 달콤히
Na na na
네 품 안에 숨긴 사랑이란 얘기 다
Talk to me Talk to me yeah
Talk-talk to me
Talk-talk-talk to me
Talk to me Boy
모든 걸 다 말해줘 Na na na
Na na na
Talk-talk to me
Talk-talk-talk to me
Na na na
Talk-talk to me
Talk-talk-talk to me
Boy you know that I'm here for you
내 두 눈을 봐
오직 너로만 가득 빛나고 있어
어서 내게 다가와
Talk to me Talk to me
날 깨운 그 날처럼 가까이 가까이
Na na na
네 두 눈에 담긴 알고 싶은 비밀 다
부드럽게 다가와
Talk to me Talk to me
투명한 이슬처럼 촉촉히 촉촉히
Na na na
네 품 안에 숨긴 사랑이란 얘기 다
Talk to me Talk to me yeah
Talk-talk to me
Talk-talk-talk to me
Talk to me Boy
모든 걸 다 말해줘 Na na na
Na na na
Talk-talk to me
Talk-talk-talk to me
Na na na
Talk-talk to me
Talk-talk-talk to me"
DAUM (Feat. Colde),"15,596",헤이즈 (Heize),"네가 날 쳐다보게 만든 다음
너의 손끝을 살짝 스친 다음
나의 눈빛에 또 나의 향기에
내 생각에 넌 잠 못 드는 밤
나를 찾게 만든 다음
넋을 잃게 만든다
너의 시야에 내가 없어질 때
네 기분은 점점 down
어쩌나 너의 마음이
이제 두둥실 떠다닐 테지
너는 나를 믿고 있고
난 그런 널 감쪽같이 잊고
어쩌다 나의 마음이
네게 잠깐은 스칠 수 있지
하지만 머물 수 없어
넌 왜냐고 물을 수도 없어
바보야
난 널 안 사랑한단 말이야
우리에게 다음 같은 건
꿈꿀 수도 없는 말이야
너를 보는 나의 마음이
미어져도 멈출 수 없지
네가 날 쳐다보게 만든 다음
너의 손끝을 살짝 스친 다음
나의 눈빛에 또 나의 향기에
내 생각에 넌 잠 못 드는 밤
나를 찾게 만든 다음
넋을 잃게 만든다
너의 시야에 내가 없어질 때
네 기분은 점점 down
넌 꿈을 꾸지 Love with me
난 안 되는 이유만이 보이지
그냥 이렇게 오늘 같이 나란히
나와 비를 맞아주면 안 되니
함께 있을 때 너 때문에 행복해 난
사랑을 말했을 땐
이별이란 악마의 눈에 띌 테니
그 말을 난 절대 못 해
나는 눈이 멀었네
악마를 볼 수 없게
바보 같은 꿈을 꿔
너 때문에 내가 왜
난 경찰이나 될까 해
시야에서 사라질 때
언제든 널 찾을 수 있게
그래 너는 robber babe
내 맘 훔치네
나는 너의 lover babe
나를 움직이게 해
내가 필요할 때
뭐든지 말해
이별 같은 거 말곤 뭐든지
다 네게 줄게
네가 날 쳐다보게 만든 다음
너의 손끝을 살짝 스친 다음
나의 눈빛에 또 나의 향기에
내 생각에 넌 잠 못 드는 밤
나를 찾게 만든 다음
넋을 잃게 만든다
너의 시야에 내가 없어질 땐
네 기분은 점점 down"
Loving U (러빙유),363,박혜경,"oh baby oh loving you oh I need you
이제 더 이상 감추려 하지마

언젠가 길을 걷다가
들려오는 음악소리에
나도 모르게 너의 모습이
잊혀진 줄 알았었는데
그땐 소중함을 몰랐던거야
그땐 외로움을 몰랐으니까

oh baby oh loving you oh I need you
이젠 내게 다시 돌아올순없니
oh baby oh loving you oh I need you
이제 더이상 감추려 하지마

La La La 언제나 몰랐던거야
그땐 외로움을 몰랐으니까

oh baby oh loving you oh I need you
이젠 내게 다시 돌아올 수 없니
oh baby oh loving you oh I need you
이제 더이상 감추려 하지마

oh baby oh loving you oh I need you
이젠 내게 다시 돌아올 수 없니
oh baby oh loving you oh I need you
이제 더이상 감추려 하지마"
Where is the Luv?,"1,638",The Hills (더 힐스),"Where is the love
찾으려 해봐도 보이질 않아
No
더 짙어지는 건
이 외로움뿐 Umm
사람 사는 게 다 똑같다는데
No
또 뻔해 그런 말
네가 하는 말이 다 맞지만
와닿지가 않는걸
혼자 있는 시간이 두려워
No more
익숙해져 버린 이 외로움과
조금씩 깊어만 가는 밤
누군가가 필요해
무언가가 필요해
Oh Where is the love
You
Oh Where is the love
You
Oh Where is the love
You
Oh Where is the love
You
Where is the love
보이지 않는 건 나 때문이래
No
인정하긴 싫어
몰랐어 정말 Um
너의 그 자리가
이렇게 내게 큰 의미였는지
네가 했던 말이 다 맞는걸
그땐 와닿지가 않았어
혼자 있는 시간이 길어져
No more
익숙해져 버린 이 시간과
조금씩 깊어만 가는 밤
누군가가 필요해
무언가가 필요해
Oh Where is the love
You
Oh Where is the love
You
Oh Where is the love
You
Oh Where is the love
You
Love
You
Love
Love
You
Love"
warm,"9,690",정기고,"You can take it slow
They’re talking shit about me
on the radio
How am I supposed to know bout you
Just let me know
cause I need to know
Are you the kind to keep me warm
아무도 없는 객석
새벽에 나타난 천사는
밤낮이 바뀐 삶을 살아
가지 말고 조금만 얘기해줘
천천히 너를 내게 나눠줘
천천히 해
우린 겁내지 않아 새로운 얘기에
아무도 없는 거리에
외로운 밤이 잠시 머물다 가네
밖에 비가 오네
You can take it slow
They’re talking shit about me
on the radio
How am I supposed to know bout you
Just let me know
cause I need to know
Are you the kind to keep me warm
우린 여전히
엉망이고 서툴지만
그냥 괜찮을지 몰라 이대로
You can take it slow
They’re talking shit about me on the radio
How am I supposed to know bout you
Just let me know cause I need to know
Are you the kind to keep me warm"
Actor,145,경제환,"사실 말은 안 했지만
이미 엎질러진 물이야 우린 우린
나도 당장은 널 앞에
두고 말은 못 하지만 맘이 이미

네가 보기 싫다거나 그런 건 아니지만
당장 다음 주라도 기약은 못해 이 관곈
우리 광명 찾아 산 넘고 물 건널까
그건 무리 아닐까
그냥 그렇다는 거야

일단 오늘은 아냐 좀 미뤄둬
(내일은 maybe 내일모레도 maybe)
그냥 내일의 나에게 맡겨둬
(내일은 maybe 내일모레도 maybe)

뭔가 잘못된 것 같지만
난 그걸 알지만 고갤 돌려 어느새
네가 이미 눈치챈 건 아닐까
그랬으면 싶단 생각을 해 어느 샌
가 난 내가 욕하던 사람이 돼 맞아
아무도 달갑지 않은 날을 기다
리는 내 맘은 어떻겠어 네가 내 맘 알겠어
사랑한단 말 애써
나는 매일 잠이 부족한 사람이 되고 말아
일찍 들어갈래 요즘 몸이 말이 아냐 너의 그
평소 같은 표정에 말들이 날 주춤하게 해

일단 오늘은 아냐 좀 미뤄둬
(내일은 maybe 내일모레도 maybe)
그냥 내일의 나에게 맡겨둬
(내일은 maybe 내일모레도 maybe)

그냥 흘려 넘길 사이로
보낼 걸 그랬어
너의 예쁜 얼굴 굳게
하기 싫어 그랬어

가끔 너를 안고 싶을 때
참을 걸 그랬어
이기적이지? 날 미워해
날 미워했으면"
꿈의 대화 (R&B Soul ver.),"1,247",SG 워너비,"땅거미 내려앉아 어두운 거리에
가만히 너에게 나의 꿈 들려주네

조용한 호수가에 아무도 없는 곳에
우리의 나무집을 둘이서 짓는다

외로움이 없단다 우리들의 꿈속에
서러움도 없어라 너와 나의 눈빛엔
마음 깊은 곳에서 우리 함께 나누자
너와 나만의 꿈의 대화를

외로움이 없단다 우리들의 꿈속에
서러움도 없어라 너와 나의 눈빛엔
마음 깊은 곳에서 우리 함께 나누자
너와 나만의 꿈의 대화를

외로움이 없단다 우리들의 꿈속에
서러움도 없어라 너와 나의 눈빛엔
마음 깊은 곳에서 우리 함께 나누자
너와 나만의 꿈의 대화를 -"
촛불 하나 (뜨거운 심장 양철로봇),"2,557",신용재 (2F),"지치고 힘들 땐 내게 기대
언제나 니 곁에 서 있을게
혼자라는 생각이 들지 않게
내가 너의 손 잡아줄게
왜 이렇게 사는 게 힘들기만 한지
누가 인생이 아름답다고 말한 건지
태어났을 때부터
삶이 내게 준 건 끝없이
이겨내야 했던 고난들뿐인 걸
그럴 때마다 나는 거울 속의 나에게
물어봤지 뭘 잘못했지
내가 무얼 잘못했길래
내게만 이래
달라질 것 같지 않아 내일 또 모레
하지만 그러면 안돼
주저앉으면 안돼
세상이 주는대로 그저 주어진 대로
이렇게 불공평한 세상이 주는대로
그저 받기만 하면
모든 것은 그대로
싸울 텐가 포기할텐가
주어진 운명에 굴복하고 말텐가
세상 앞에 고개 숙이지 마라
기죽지 마라
그리고 우릴 봐라
지치고 힘들 땐 내게 기대
언제나 니 곁에 서 있을게
혼자라는 생각이 들지 않게
내가 너의 손 잡아줄게
오 너무 어두워 길이 보이지 않아
내게 있는건 성냥 하나와 촛불 하나
이 작은 촛불 하나
가지고 무얼 하나
촛불하나 켠다고 어둠이 달아나나
저 어둠 속에서
불빛을 향해서 저 빛을 향해서
날고 싶어도 날 수 없는 나의 날개짓
하지만 그렇지 않아
작은 촛불 하나 켜보면
달라지는 게 너무나도 많아
아무것도 없다고 믿었던 내 주위엔
또 다른 초 하나가 놓여져 있었기에
불을 밝히니 촛불이 두 개가 되고
그 불빛으로 다른 초를 또 찾고
세 개가 되고 네 개가 되고
어둠은 사라져가고
지치고 힘들 땐 내게 기대
언제나 니 곁에 서 있을게
서 있을게
혼자라는 생각이 들지 않게
내가 너의 손 잡아줄게
지치고 힘들 땐 내게 기대
언제나 니 곁에 서 있을게
혼자라는 생각이 들지 않게
내가 너의 손 잡아줄게
아버님 없이 마침내 우리는 해냈어
그건 바로 나의 어릴 적 얘기였어
사실이었어 참 힘들었어
하지만 거기서 난 포기하지 않았어
꿈을 잃지 않고 용기를 잃지 않고
노력하다 보니 여기까지 왔고
이제 너희들에게 말을 해주고 싶어
너희도 할 수 있어
내가 너의 손 잡아줄게
내가 너의 손 잡아줄게
내가 너의 손 잡아줄게
내가 너의 손 잡아줄게
지치고 힘들 땐 내게 기대
언제나 니 곁에 서 있을게
서 있을게
혼자라는 생각이 들지 않게
내가 너의 손 잡아줄게
지치고 힘들 땐
지치고 힘들 땐 내게 기대
언제나 니 곁에 서 있을게
곁에 서 있을게
혼자라는 생각이 들지 않게
내가 너의 손 잡아줄게
내가 너의 손 잡아줄게
내가 너의 손 잡아줄게"
THERE SHE GOES (PROD BY KyrieFx),"5,767",실키보이즈 (SILKYBOIS),"WHERE YOU TRYNA GO TODAY
GIRL LET ME KNOW
마지막으로 갈게 너를 데리러
단지 삼십분이면 돼
YEAH THERE SHE GOES
YEAH THERE SHE GOES
YEAH THERE SHE GOES
I’M NOT THE TYPE
WHO BE CHASIN ALL THE CLOUT
YEAH SHE KNOWS
I’M THE TYPE
WHO BE CHASIN ALL THE GUAP
YEAH SHE KNOWS
혼자가 낫다 했잖아 어차피 넌
PIN YOUR SPOT 갈게 너를 데리러
넌 여태 보이는 것만을 믿지
그래서 아직 이런 나를 믿니
BEEN A FEW DINNERS
WIT SOME OTHER BITCHES
BUT FOR U I NEVER BEEN
IN THE KITCHEN
THE MOMENT WHEN I WAS
ON A WAY OUTTA CITY
THE MOMENT WHEN I WAS
ON MEDS OUTTA SECRET
THROW IT BACK 따위는 시간낭비지
가는 길에 해댔던 혼잣말이지
I AIN’T GON MAKE IT WORSE AGAIN
JUST WANNA MAKE IT WORK OKAY
함께 아플 시간마다
니 눈만 물들어 시뻘겋게
니 뜻대로 노력해도
안 되는데 행복해
널 부럽게 봤던 니 친한 친구들
NOW THEY DON’T CARE
둘이 같이 새겼었던
여권 위 문신
지웠다가 써서
더럽던 편지 글씨
맘에 지워야지
원래 없었던 듯이
IMMA TAKE SOME TIME BY MY OWN
I DON’T WANT NO NEW SHIT
YEAHHH
THERE SHE GOES
STILL LOOKIN CALIENTE
STILL HOTTER THAN MEXICO
YEAH THERE SHE GOES
THAT SHE KNOWS
나 또한 보이는 걸 믿기에
네게 손 대지 또
WHERE YOU TRYNA GO TODAY
GIRL LET ME KNOW
마지막으로 갈게 너를 데리러
단지 삼십분이면 돼
YEAH THERE SHE GOES
YEAH THERE SHE GOES
YEAH THERE SHE GOES
I’M NOT THE TYPE
WHO BE CHASIN ALL THE CLOUT
YEAH SHE KNOWS
I’M THE TYPE
WHO BE CHASIN ALL THE GUAP
YEAH SHE KNOWS
혼자가 낫다 했잖아 어차피 넌
PIN YOUR SPOT 갈게 너를 데리러
많이 지쳤다면 오늘 밤은 내가 갈게
왜 아무 말이 없니 지금 갈게
이대로 끝나면 안 돼
그럼 미안한 게 너무 많아
작업 때려 치고 당장 널 보러 갈게
늘 일이 먼저고 넌 뒤였어
니가 반했던 그 때 내 모습
다시 보여주고 싶어서
너가 돈을 아끼잔 말이 싫어서
너가 콘돔을 끼란 말에 찔려서
보고 싶어도 난 미뤘어
삐진 널 달래고선
다시 구석에 밀었어
baby 미안해
나 그냥 돈을 못 벌어서 맨날 불안해
다 카니발에 있는데
나만 니 품 안에서
징징대는 게 한심해
나도 너한테
세상을 다 주고 싶어 근데 어려워
더는 기다려달란 말도 이젠 두려워
당장 날 못 보는 게 뭐 그리 서러워
결국 돌아갈 곳은 너뿐인 걸 이렇게
다 때려 치고 갈게 30분이면 돼
WHERE YOU TRYNA GO TODAY
GIRL LET ME KNOW
마지막으로 갈게 너를 데리러
단지 삼십분이면 돼
YEAH THERE SHE GOES
YEAH THERE SHE GOES
YEAH THERE SHE GOES
I’M NOT THE TYPE
WHO BE CHASIN ALL THE CLOUT
YEAH SHE KNOWS
I’M THE TYPE
WHO BE CHASIN ALL THE GUAP
YEAH SHE KNOWS
혼자가 낫다 했잖아 어차피 넌
PIN YOUR SPOT 갈게 너를 데리러"
Softly,"7,407",미연 ((여자)아이들),"서두르지 마
내게 다가올 땐
차갑지도 않게 Baby
뜨겁지도 않게 Baby
날 아껴줘 Softly baby
서두르진 말고
바라봐 줘 Softly baby
기다려 줘 Softly
So give me love softly
내 말투 눈빛 지금 기분 어떤지
알고 싶어 미치겠지
쉽게 알려 줄 생각은 없어
아직은 안 돼 Know you want it
맘은 알지만 뭐가 그리 급해
시간은 많은데 더 알아가면 돼
내 맘을 두드려 줘 부드럽게
눈을 맞추고 웃어줘
그렇게 솔직한 게 좋아
Show me hundred percent
조금씩 그렇게
템포를 맞춰서 천천히 걸어줘
내 맘이 열릴 때 다가갈 수 있게
서두르진 말고
내게 다가올 땐
차갑지도 않게 Baby
뜨겁지도 않게 Baby
날 아껴줘 Softly baby
서두르진 말고
바라봐 줘 Softly baby
기다려 줘 Softly
So give me love softly
솜사탕 같은 맘이 녹지 않게 Save me
날 아껴줘 Softly baby
So give me love softly baby
고양이 같은 내 맘이 놀라지 않게
날 아껴줘 Softly baby
So give me love softly baby
특이하다 하지만 유별난 것 같지만
겁이 좀 많은 것뿐이야
조심성이 많을 뿐이야
이런 게 더 재밌지 않니
호기심을 자극 중
어때 Come be my love
너무 진지한 분위긴 부담스럽지
적당히 편하고 따스하게
지나치지 않고 깔끔하게
가볍진 않게 다가와 줄래
기댈 수 있게 듬직한데
유머 감각은 있어야 돼
템포를 맞춰서 천천히 걸어줘
내 맘이 열릴 때 다가갈 수 있게
서두르진 말고
까다롭기는 하지만 예민하기도 하지만
사실 네가 좋아 Love me softly baby
조금 어색하지만 부끄럽기도 하지만
사실 네가 좋아 Love me softly baby
까다롭기는 하지만 예민하기도 하지만
사실 네가 좋아 Love me softly baby
조금 어색하지만 부끄럽기도 하지만
사실 네가 좋아 Love me softly baby
내게 다가올 땐
차갑지도 않게 Baby
뜨겁지도 않게 Baby
날 아껴줘 Softly baby
서두르진 말고
바라봐 줘 Softly baby
기다려 줘 Softly
So give me love softly"
"NPC (Feat. 한해, Choi, L.Do) (Prod. Big wave, Zunnlee)",61,MUSM,"Hey baby
내 말 좀 들어줘 maybe 넌
Non-player character
너밖에 없지 you are selfish
이제는 질렸어 매일이
I decided to leave you
넌 나만 만나면 왜 이리 바쁜지
똑같아 모든 대답이
Anything Anything Anything Anything
혼자 하는 게임 속에 갇힌 것 같이
아무리 말을 걸어도
Anything Anything Anything Anything
하

You seem like an NPC
I can’t go with you
너는 여기에 있어
앞으로는 더 이상 네게 상처받지 않게
If I were a god
내 맘대로 움직여
Enter it make you love me

Hey lady
뭘 물어 당연히 사랑하지
Yes maybe yes baby a
머리가 바뀌었나 아님 목걸이를 뺐나
아무튼 예뻐 anything
카페 아님 동네 영화관
가고 싶은 대로 take me
Baby you look fancy 묻지 마
신경 쓸게 너무 많아져 가는데
요즘엔 다 귀찮아 no는 없어 걱정마
I’m freakin' quntaiz
딱딱 맞춰져 있는 게 편하잖아
Why do you lookin’ at me
Why do you lookin’ at me
Baby 난 없어 비밀
Baby 난 없어 비밀

You seem like an NPC
You seem like an NPC
I can’t go with you
너는 여기에 있어
앞으로는 더 이상 네게 상처받지 않게
If I were a god
내 맘대로 움직여
Enter it make you love me

나도 이리저리 치인 채로 왔어
이미 다 썼어 배터리 방전
너한테 전부 어떻게 맞춰
관심 없다고 연예인 gossip
이미 내 머리 안에 space 암전
다시 한번 전부 어떻게 맞춰
내가 어떻게 매일 너를 살펴
알잖아 너를 사랑하는 만큼
매일 일어나는 다툼
솔직함을 빙자한 너의 무례함도
난 다 들어줬다고
까칠한 게 아니고
Just for today
혼자였으면 해
그냥 지나가 줘 오늘 밤은

You seem like an NPC
You seem like an NPC
I can’t go with you
너는 여기에 있어
앞으로는 더 이상 네게 상처받지 않게
If I were a god
내 마음대로 움직여
Enter it make you love me"
Painting (Art. Lay.bn (레이븐)) (Prod. LiO),"15,364",Anonymous Artists(어나니머스 아티스트),"검정이 돼가고 있어
나 아직 겁이 많아서
넌 철이 없던 어린애
가 맞았으면 좋겠어
상처 많고 어린 앤
나로 끝났으면 좋겠어
사실 잘 모르겠어
사실 널 모르겠어
여러 색들이 섞이다가
결국 남은 게 black
아무것도 안 보이는 게
차라리 편했나
when i naked 그냥 동화됨
난 어떻고 너는 어떤지
중요하지 않잖아
나 물어보지 않을게
우리 그냥 헤엄치다
만나자고 언젠가는
너도 지쳐 나도 지쳐
물속 얘길 전하자고
cause you make me black
you make me black
cause you make me black
you make me black
내 보라색에 널 섞었더니
더 짙어져 안 보여
눈이 멀었었나 봐
난 검은색인 걸까
내 보라색에 널 섞었더니
더 짙어져서 안 보여
눈이 멀었었나 봐
난 검은색이지
cause you make me black
너와 그렸던 건 문이었나 봐
둘 다 갇혀있어서
서로를 할퀴었나 봐
cause you make me black
이젠 서로의 밤을 보내고
네가 보이니까 알겠어
둘 다 상처 입었단 걸
너를 이해하게
좀 더 느려질 게
내게 발맞추고
계속 노랠 할 게
너를 이해하게
좀 더 느려질 게
내게 발맞추고
계속 노랠 할 게
내 보라색에 널 섞었더니
더 짙어져 안 보여
눈이 멀었었나 봐
난 검은색인 걸까
내 보라색에 널 섞었더니
짙어져서 안 보여
눈이 멀었었나 봐
난 검은색이지
cause you make me black
너와 그렸던 건 문이었나 봐
둘 다 갇혀있어서
서로를 할퀴었나 봐
cause you make me black
이젠 서로의 밤을 보내고
네가 보이니까 알겠어
둘 다 상처 입었단 걸
너를 이해하게
좀 더 느려질 게
내게 발맞추고
계속 노랠 할게
너를 이해하게
좀 더 느려질 게
내게 발맞추고
계속 노랠 할게"
"so i call it love (Feat. jeebanoff, CHANGMO) (Prod. TOIL)","8,734",릴러말즈 (Leellamarz),"사랑 비스무리한걸 나는 매일 해
사랑 비스무리한걸 나는 매일 해
사랑 비스무리한걸 나는 매일 해
사랑 비스무리한걸 나는 매일 해
So I call it love L O V E yea
So I call it love L O V E yea
So I call it love L O V E yea
So I call it love L O V E yea
난 매일 먹고 매일 벌고 써
바쁜 하루 안아줄 사람도 난 없어
하루 종일 돌고 돌아 도착한 곳 너
안아주고 감싸주면
yea I call it love yeah
돈 명예 다 좋아
근데 나는 nono
친구들 좋다고 난리지만
나는 왠지 모르게 다 so so
한 번 사는 인생 그냥 살 거야
like a yolo
사랑 비스무리한걸 나는 매일 해
사랑 비스무리한걸 나는 매일 해
사랑 비스무리한걸 나는 매일 해
사랑 비스무리한걸 나는 매일 해
So I call it love L O V E yea
So I call it love L O V E yea
So I call it love L O V E yea
So I call it love L O V E yea
매일 난 아무런 이유 없이
걍 기분이 막 좋아
내 생각엔 너 하나 땜에
나 변한 것 같아
내일이 또 오는게
이리 행복한지 몰랐어 난
이 모든게 너 하나 때문에
다 변한 것 같아
궁금해난 오늘에
네가 어제보다 얼마나 더 예쁠지
간밤에 난 밤을 새
너만 생각을 해 잠을 설쳤지
어려워 너무 넌
어떤 색깔 옷을 좋아할지
종일 고민하고 나온
이 모습은 어떤지
사랑 비스무리 한걸 나는 매일해
이젠 너도 알아줄 것 같은 때인데
사랑 비스무리 한것도 같은데
넌 지금 우리 어떻게 생각해
널 만날 때면 너의 눈을 먼저 확인해
밤새 근심은 없었나 왼손을 잡은 채
넌 말해 왜왜 얼굴에 뭐 묻었어
아니 내 여자 어제보다
더 이뻐서 세 시간전
아 왜 난 검은 옷만 있니
오늘은 하얀색을
입어야 될 것 같은 느낌이 드는데
색깔 들어간 검은 셔츠 골라 입지
어둡던 나와 화사한 색깔
덧칠해준 너와 같아
우린 이 거리를 그저 거닐지
모르겠어 이 동네가 어딘지
그대 조종하니 나의 머리를
사람들은 나를 보고 사진 찍어달래
그래 그게 맞아 내가 사는 서울이지
허나 뭔가 이제 들어 나 새 느낌이
이 새로운 느낌 너 덕이지"
Just Like The Rain,"9,036",GRAY (그레이),"그날도 비가 내렸어
시간이 멈췄음 했어
Close your eyes
Think about that time
Baby u so beautiful
못 떼겠어 두 눈에서
You're so fine
Can't take my eyes off you
너는 정말 향기로와
You're just like a rose
항상 나를 눈부시게 하네
Like the sun
Every day and night
니가 생각나
내 맘의 단비
You make my heart beat
You
Just like the rain
Just like the rain
Just like the rain
Just like the rain
Just like the rain
Just like the rain
잠시 이어폰을 나눠 껴
흘러나오는 음악을 들어
우린 추억에 젖어 생각 속에 잠겨
흘러내리고 있는 저 비처럼 yeah yeah
굳이 말을 많이 안 해도
마음의 소릴 서로 알아들어
방황하는 나의 손을 꼭 잡아줘
그리고 내 품에 안겨줘
너는 정말 향기로와
You're just like a rose
항상 나를 눈부시게 하네
Like the sun
Every day and night
니가 생각나
내 맘의 단비
You make my heart beat
You
Just like the rain
Just like the rain
Just like the rain
Just like the rain
Just like the rain
Just like the rain
Just like the rain
Just like the rain
Just like the rain
Just like the rain
Just like the rain
Just like the rain"
"다시, 여름 (Hello, Sunset)","19,363",Red Velvet (레드벨벳),"노을빛에 물든 네 향기
익숙함에 미처 몰랐지
뜨거운 여름의 끝자락
또다시 설렘이 번져와

네 어깨 뒤로 일렁이는 추억들
눈빛 따라 살랑이는 바람결
사랑을 본 것만 같아 난
이토록 아름다운 네 맘도

저 하늘 가득 담아 네게 노래해
다시 눈 마주친 순간 Fall in love
고마워 날 기다린 만큼
꼭 안아줄게

이 여름을 돌고 돌아
저물어가는 시간
인사를 건네
Hello hello hello

하고 싶은 말은
아직 전하지 못했지만
뜨겁게 다시
Hello hello hello yeah

돌아보면 왠지 오늘이
눈물 날 것처럼 아련히
자고 나면 사라질 꿈만 같아
두 눈을 맞춰도 그리운 밤

내 얼굴 위로 너울지는
그림자도 너를 닮아
하나가 된 Feeling
But 때론 두려워져 Yeah

더 깊어가는 밤하늘을 기억해
우리 맘을 잔상처럼 남긴 채
이 여름을 잊지 않기로
약속해 줄래

이 계절을 돌고 돌아
다시 또 만날 그날
늘 오늘처럼
Hello hello hello

잘 지냈니? 인사 없이
네 품에 안길 그날
뜨겁게 다시
Hello hello hello yeah

이 여름을 돌고 돌아
저물어가는 시간
인사를 건네
Hello hello hello

처음처럼 너와 내가
늘 같은 모습으로
뜨겁게 우리
Hello hello hello yeah

뜨겁게 다시 Hello"
