Title,Likes,Singer,Lyrics
Heart,"4,139",msftz (미스피츠),"Here I fall in love again
나는 정말 쉬워요
내게 좀만 다정해주면
바로 사랑에 빠져 버려요

One sided love affair
하고 싶지 않아요
이뤄질 수 없다는 걸 알면서
자꾸 Falling, falling

One sip, two sip 마시기 시작한지 얼마 안됐어
어느새 손끝 발끝 모든 곳을 파고들어 정복하네
Good trip or bad trip 우주에서 땅끝까지
긴 레일이 펼쳐져 있네 난 매일 이 여행을 해

너의 흔적이 없는 부위가 없어
You've conquered me
But you want her
Make me poor
You're so special, and It's painful
Look, I'm unstable
My angel, you're fatefully hurting me

Here I fall in love again
나는 정말 쉬워요
내게 좀만 다정해주면
바로 사랑에 빠져 버려요

One sided love affair
하고 싶지 않아요
이뤄질 수 없다는 걸 알면서
자꾸 Falling, falling

그래 널 좋아하지 않을 사람은
아마 이 세상에 없을 거야
그 특별하고 따뜻한 에너지는
주변의 모든 것들에 숨을 불어넣고

놀라움에 나는 그저 바라볼 수밖에 없네
마치 좀 있으면 곧 사라질 Sunset
놓칠 수 없어 머릿속엔 널 업데이트
웃음 표정 목소리 캡처해 썸네일

Here I fall in love again
나는 정말 쉬워요
내게 좀만 다정해주면
바로 사랑에 빠져 버려요

One sided love affair
하고 싶지 않아요
이뤄질 수 없다는 걸 알면서
자꾸 Falling, falling

When you're not around
Baby, I feel like I'm drowning
네 얼굴은 흐릿하게
기억할 수가 없네
Defense mechanism
잊으라 하는 듯해
깊어지면 괴로울 테니까

Here I fall in love again
나는 정말 쉬워요
내게 좀만 다정해주면
바로 사랑에 빠져 버려요

One sided love affair
하고 싶지 않아요
이뤄질 수 없다는 걸 알면서
자꾸 Falling, falling

Here I fall in love again
나는 정말 쉬워요
내게 좀만 다정해주면
바로 사랑에 빠져 버려요

One sided love affair
하고 싶지 않아요
이뤄질 수 없다는 걸 알면서
자꾸 Falling, falling"
In The Dark,69,VIN,"나 어떡해야 해
떠난 네 마음을 돌리기 위해
뒤늦은 후회
할 줄은 몰랐었기에

홀로 남았네
늦은 이 밤에
갈 곳을 잃은 발걸음을
네게 돌려볼까 해

In the dark
I just try 여기
흘러나온 기억이
내 두 눈을 가렸지
더 깊이 빠져들까 봐

I need you
다른 누구도
너를 대신할 수 없을 것
같아 잘 알잖아

I don't wanna lose your mind
I don't wanna lose your hearts
I don't wanna be
I don't wanna be
I don't wanna be alone

I don't wanna lose your Love
I don't wanna lose your touch
I don't wanna be
I don't wanna be
I don't wanna be alone

차라리 잘 된 거라고
생각을 해봐도
난 벗어날 수도 없어
이곳에서

떠나지 못한 채
너를 기다릴게
깊은 밤을 보내

In the dark
I just try 여기
홀로 남은 기억이
내게 속삭이길
바라진 못하는 거지

바래진 기억 속 어디
라도 붙잡고 머물고 싶은 마음에
여기 남아볼까 해

I don't wanna lose your mind
I don't wanna lose your hearts
I don't wanna be
I don't wanna be
I don't wanna be alone

I don't wanna lose your Love
I don't wanna lose your touch
I don't wanna be
I don't wanna be
I don't wanna be alone

I don't wanna lose your mind
I don't wanna lose your hearts
I don't wanna be
I don't wanna be
I don't wanna be alone

I don't wanna lose your Love
I don't wanna lose your touch
I don't wanna be
I don't wanna be alone"
Cotton Candy (with EJEAN),87,Sam Ock,"Oh we’re floating along
We can go off into the sunset
Take my arm
My dear let’s carry on

Our love is sweet, it’s so yum
The feelings are fuzzy warm
It’s cotton candy love
My dear we’ve just begun

Wait a minute
I never thought that love could be like this
Kinda like rocky road at first
Brain freeze like an icy kiss
We though that
It would be
So easy
But we just didn’t know

Let’s take it slow
We can take a little time
A taste of your love
And lemme share you some of mine
Oh my, I’m kinda shy
What a day to be alive
Let’s give our love another try
(Let’s get it, let’s get it one time)

Oh we’re floating along
We can go off into the sunset
Take my arm
My dear let’s carry on

Our love (yea our love) is sweet, it’s so yum
(Yum yum yum yum)
The feelings are fuzzy warm
It’s cotton candy love
My dear we’ve just begun

You’re my cotton candy
Simply sweet like honey
My honey, let’s love like we are young
(Young, young, young, young)
We didn’t have no money
No glam and no glory
But you and I were funny
And that’s all that we needed, yea

Let’s take it slow
We can take a little time
A taste of your love
And lemme share you some of mine
Oh my, I’m kinda shy
What a day to be alive
Let’s give our love another try
(Let’s get it, let’s get it two times)

Oh we’re floating along
We can go off into the sunset
Take my arm
My dear let’s carry on

Our love (yea our love) is sweet, it’s so yum
(Yum yum yum yum)
The feelings are fuzzy warm
It’s cotton candy love
My dear we’ve just begun

Cotton candy
Cotton candy
Cotton candy love
Cotton candy
Cotton candy
Cotton candy love

Cotton candy
Cotton candy
Cotton candy love
Cotton candy
Cotton candy
Cotton candy love"
잘 있니,"6,792",수안,"겁이 많아서일까
생각이 많아서일까
이별을 대하는 마음이 변한 것 같아
만나기도 전에 헤어질 준비를 하고
쉽게 마음 주진 않으려 해
눈물을 참는 법을 또 배워간다
더 이상 아플 자신 없어
거울 속의 나는 항상 외로워 보여
뭐 땜에 너 땜에
넌 잘 있니 난 좀 그래
잊어보려 했는데 자꾸 생각이 나서
가끔은 이렇게 네가 보고싶어
하늘만 보게 돼
부끄러운 마음에
하지 못했던 한마디
가지 마 가지 마
쉬운 그 말을 못했어
넌 잘 있니 난 좀 그래
짧은 너의 인사가 왜 이리 서운한지
서글픈 안녕이 네겐 부담일까 봐
그냥 웃어버렸어
난 좀 그래
웃어보려 했는데 어색해 보였을까
이런 내 마음이 널 힘들게 할까 봐
아무 말도 못했어
난 좀 그래
나을 줄 알았는데 아직 많이 아파 난
참았던 눈물이 이제야 흐르나 봐
네가 보고 싶다"
미니카 (Drive),"16,490",NCT DREAM,"괜시리 맘이 울적할 때
현실은 잠시 잊고 놀러 와
널 태우고 난 달려갈게
늘 비워 둔 내 옆자린 For you

매번 너에게만 yeah
유독 깊은 밤을 넘어
oh 어느새 거울엔
키만 큰 어린애 좀 어색해
oh 작아져 넌 순간 yeah

되고 싶은 게 가득했고
장난스런게 당연했고
꽤나 진지했었던 고민 속
함께 울고 웃던 그 때로 oh oh

괜시리 맘이 울적할 때
현실은 잠시 잊고 놀러 와
널 데리러 나 달려갈게
네 맘을 실어줘
온종일 뛰어놀던 동네
눈부신 계절 빛 그 하나도
여전하게 널 비춰
사라져 모든 고민도

반가운 그 목소리
가득한 웃음소리
함께 한 노랫소리
그 때로 함께 가는 거야

마냥 즐겁던 그땐 yeah
별것도 아닌 일에 파랗게
터지던 웃음에 물들어
가던 순간을 Right back
늘 함께였던 Best friend yeah eh

그게 너였단 게 다행이야 난

괜시리 맘이 울적할 때
현실은 잠시 잊고 놀러 와
널 데리러 나 달려갈게
네 맘을 실어줘
온종일 뛰어놀던 동네
눈부신 계절 빛 그 하나도
여전하게 널 비춰
사라져 모든 고민도

반가운 그 목소리
가득한 웃음소리
함께 한 노랫소리
그 때로 함께 가는 거야

ay ayo don’t worry No hurry
눈 감고 and fade in
슥 당겼다 놔
이제 달리는 바퀴
시간이 가도
We don’t need batteries
Question though
Now are you happy?

또다시 시작돼
오늘이란 Racing
매일 다른 Rules
처음 보는 New tracks
자 어서 골라
널 위한 미니카
So good timing

둘이서 뛰놀던
그곳에 곧 멈춰서
벅차게 내린 그날의
햇살 같은 꿈 따라서

발소리마저 늘어질 때
곧 울 것 같은 눈을 감아 봐
기억에 멈춘 미니카에
내 마음 보낼게

반가운 그 목소리
가득한 웃음소리
함께 한 노랫소리
그 때로 함께 가는 거야

날 부른 네 목소리
달리는 내 발소리
(빨라져 가지 baby)
함께 할 노랫소리
그 때로 함께 가는 거야"
오만과 편견 (Feat. J.O.Y),"1,894",뎁트,"I kept a smile on my face
계속 웃고 있기는 하지만
Didn’t mean it
진심은 아니었어요
Even though I be bleeding inside out
속이 새빨갛게 헐어도
I thought I knew what love is
사랑이 뭔지 알고 있다고 생각했거든요
Guessed I viewed these feelings
이 감정을 멍하니 바라본 것 같아요
Like a paper of nothing
아무것도 없는 빈 종이처럼

I’ve lost all of my reasoning before
예전에 난 이성을 잃은 사람이었어요
But you made me realize
하지만 그대가 날 깨닫게 해준 거죠

You took my pride for the better
내게 더 나은 자존감을 안겨 준 그대
The mist is now gone
안개가 걷히고 있네요
You took my pride for the better
내게 더 나은 자존감을 안겨 준 그대
Cause you changed my view of life
삶을 바라보는 시선이 달라졌어요
No more prejudice
더는 편견도
No more selfishness
이기심도 없어요
I want you forever
그대를 영원히 바랄 뿐
You took my pride for the better
내게 더 나은 자존감을 안겨 준 그대
The mist is now gone
안개가 걷히고 있네요
You took my pride for the better
내게 더 나은 자존감을 안겨 준 그대
Cause you changed my view of life
삶을 바라보는 시선이 달라졌어요
All the mirrors they broke
나만 비추던 거울이 깨지고
The heavy curtain is gone
무겁게 드리운 커튼이 사라졌어요
I want you forever and ever
영원보다 더 그대를 원해요

I am sorry I judged you like an open cover
미안해요, 그대를 겉만 보고 판단했죠
You’re my favorite book to read
그대는 내가 가장 좋아하는 책이에요
Cause I discovered who I am and who I was
나의 존재를 그대 안에서 알게 되니까
Now I see the weather clearly
이제 날씨가 분명하게 보여요
And the dark is turning to light
어둠이 빛으로 변하고 있죠

I've lost all of my reasoning before
예전에 난 이성을 잃은 사람이었어요
But you made me realize
하지만 그대가 날 깨닫게 해준 거죠

You took my pride for the better
내게 더 나은 자존감을 안겨 준 그대
The mist is now gone
안개가 걷히고 있네요
You took my pride for the better
내게 더 나은 자존감을 안겨 준 그대
Cause you changed my view of life
삶을 바라보는 시선이 달라졌어요
No more prejudice
더는 편견도
No more selfishness
이기심도 없어요
I want you forever
그대를 영원히 바랄 뿐
You took my pride for the better
내게 더 나은 자존감을 안겨 준 그대
The mist is now gone
안개가 걷히고 있네요
You took my pride for the better
내게 더 나은 자존감을 안겨 준 그대
Cause you changed my view of life
삶을 바라보는 시선이 달라졌어요
All the mirrors they broke
나만 비추던 거울이 깨지고
The heavy curtain is gone
무겁게 드리운 커튼이 사라졌어요
I want you forever and ever
영원보다 더 그대를 원해요

Tell me what can I do now?
내가 할 수 있는 걸 알려 줄래요?
Forgive my past for being loud
소란스러웠던 내 과거를 용서해줘요
Tell me what can I do now?
내가 할 수 있는 걸 알려 줄래요?
I was too ignorant
내가 너무 몰랐어요
I have learned my lesson
교훈을 얻었죠
To never want perfection
완벽함을 추구하지 않겠다고
Cause you are my best mistake forever
내 인생 최고의 실수는 영원히 그대이니까

You took my pride for the better
내게 더 나은 자존감을 안겨 준 그대
The mist is now gone
안개가 걷히고 있네요
You took my pride for the better
내게 더 나은 자존감을 안겨 준 그대
Cause you changed my view of life
삶을 바라보는 시선이 달라졌어요
No more prejudice
더는 편견도
No more selfishness
이기심도 없어요
I want you forever
그대를 영원히 바랄 뿐
You took my pride for the better
내게 더 나은 자존감을 안겨 준 그대
The mist is now gone
안개가 걷히고 있네요
You took my pride for the better
내게 더 나은 자존감을 안겨 준 그대
Cause you changed my view of life
삶을 바라보는 시선이 달라졌어요
All the mirrors they broke
나만 비추던 거울이 깨지고
The heavy curtain is gone
무겁게 드리운 커튼이 사라졌어요
I want you forever and ever
영원보다 더 그대를 원해요"
깊어져,680,Jimmy Brown,"마치 아무렇지 않은 듯이
아름다운 걸 왜 숨기겠어
멍하니 널 바라볼 땐
어떤 말로 널 표현하겠어

hi
can i
swim over
to your ocean
만약 두 눈 깊이 닿는다면
네가 나인 듯 안아줄래

점점 깊어져
하나 둘 셋까지
아홉 열까지도
헤엄, 마음 더해서
네게 전부 물들 때까지


오늘 어때? 란 말 대신
고민들 다 알아내기
on my way 어디든 언제든 갈게
옆에 늘 있을게란 말 약속해
you give me butterflies when you come around
Can’t wait another second
Don't you keep me waiting

hi
can i
swim over
to your ocean
만약 두 눈 깊이 닿는다면
네가 나인 듯 안아줄래

점점 깊어져
하나 둘 셋까지
아홉 열까지도
헤엄, 마음 더해서
네게 전부 물들 때까지"
I'm Not Sure (Feat. maji),351,아영 (YOUNG),"아무런 의미도 없이 사는 건 너무 불안해
다들 그저 그렇게 사는데 나에겐 맞지가 않네
또 또 호기심에 또 그렇게 데여놓고 또
왜 또 태연한 척 사랑을 하려 하는데
아냐 다를 것 같아 이제 나 괜찮은 것 같아
Umm I’m ready to love

I’m not sure 확실한 건 하나 없다는 건 확신해
Ain’t got no 답을 찾고 있어 tell me more about it
우린 다르지 않을까라는 기대감에 가득 차
La la la la la la umm I’m not sure

Anything I don’t know about you
네가 어떤 사랑을 했던지
지금 나와, 우리 둘 사이의 따스한 온기가 더 중요해
넌 운명이란 걸 믿겠니

나도 믿고 싶은데 널 안아 주고 싶은데
또 나쁜 생각만 하는 날 보면 참 (한심해 죽겠어)
아냐 다를 것 같아 이제 나 괜찮은 것 같아
Umm I’m ready to love

I’m not sure 확실한 건 하나 없다는 건 확신해
Ain’t got no 답을 찾고 있어 tell me more about it
우린 다르지 않을까라는 기대감에 가득 차
La la la la la la umm I’m not sure

비가 내리면 햇살도 반드시 널 비춰줄 테니
Boy, don’t be afraid 이제는 내가 널 안아줄게
You are my love

I’m not sure 확실한 건 하나 없다는 건 확신해
Ain’t got no 답을 찾고 있어 tell me more about it
우린 다르지 않을까라는 기대감에 가득 차
La la la la la la umm

I’m not sure 모든 걸 확실하게 할 필요는 없단 걸
알아 답은 이제 중요하지 않아
우린 다르지 않을까라는 기대감에 가득 차
La la la la la la umm"
나랑 있자 (BE WITH ME),"11,653",TREASURE (트레저),"몇 시야
시간 좀 보지 마
Don't know why

파란 moonlight
이미 깊은 밤이야
어딜 가

조금만 더 볼래
또 급하게 집에 가 뭐해
It's very very fine
천천히 천히 가

어쩔 수가 없네
막차까지 끊긴 것 같아
That's very very nice
내가 지켜 줄 수밖에 없는걸

바람 부는 밤에
온통 까만 하늘 아래
어딜 가요 걱정돼요

보름달이 뜨네
집에 돌아가는 길에
늑대들이 너를 잡아채 갈걸

나랑 있자
가지 마 가지 마 girl

그냥 나랑 있자
It’s up to you

네가 뭐라 뭐라 내게 말해도
위험 위험해

Tell me tell me
어떤 변명도 안 통해
매일 밤 서로를 하늘에
그리기만 해 또
오늘은 못 넘어가
사랑 아닌 그리움
Not a chance only you

우리 계속 play all night
어디에도 가지 말아 줘
나랑 손을 잡으면서
너랑 계속 있고 싶어
나를 떠나지 마

조금만 더 볼래
또 급하게 집에 가 뭐해
It's very very fine
천천히 천히 가

믿을 수가 없네
우리 코가 맞닿은 것 같아
That's very very nice
이제 지켜 줄 수밖에 없는걸

바람 부는 밤에
온통 까만 하늘 아래
어딜 가요 걱정돼요

보름달이 뜨네
집에 돌아가는 길에
늑대들이 너를 잡아채 갈걸

나랑 있자
가지 마 가지 마 girl

그냥 나랑 있자
It’s up to you

네가 뭐라 뭐라 내게 말해도
위험 위험해

꿈인 듯 꿈이 아닌 듯이 꿈속 같은 너
Oh dreamy girl You’re dreamy girl

내 가슴 가득 차게 너를 안아줄 거야
저 별을 따라 내게 흘러와 준 너

지금부터 새벽까지
어디든 걸어가자 나와 같이
뭘 해봐도 난 너에게로 이끌려가
Girl 너의 미술 같은 입술

새벽 넘어 아침까지
누가 뭐라 뭐라 나를 탓해도
너를 좋아해"
글라이더 (With. SOMA),"2,229",그리즐리 (Grizzly),"길거리에 버려진 길 고양이들과
어릴 때 자주 가던 슈퍼마켓에 앉아
동전을 수없이 꽂아 넣은 오락기와
아무 생각 없이 걸었던 그 길을
여러 색으로 물들어버린 내 맘으로
아무 생각 없이 내뱉던 그날들
여러 색으로 물들어버린 맘으로
음
Go back in time
If u wanna go back
음
Go back in time
If u wanna go back
음
Go back in time
If u wanna go back
음
학교를 마치고 난 뒤
종이컵에 담아
먹은 떡볶이와
몇백 원에 내기를 하던
또 휠리스에 눈이 팔려
하고 싶지도 않은
학습지를 하게 되었던
그때의 내가 지금 필요해
자그마한 문방구에 파는
글라이더를 날리며
내 친구들과 놀이터에 앉아
은색 동전을 찾을 때
Go back in time
If u wanna go back
Go back in time
If u wanna go back
Go back in time
If u wanna go back
Go back in time
If u wanna go back
길거리에 버려진 길 고양이들과
어릴 때 자주 가던 슈퍼마켓에 앉아
동전을 수없이 꽂아 넣은 오락기와"
Thinkin Bout You,"15,247",KATIE,"Yeah I don’t know
why you’re messing around
with all them other girls
Acting like you’ve got
all of the time left in the world
I promise that if you were mine
I’d never let it go to waste
I can tell that you’ve been
hurt before I know
because so was I
I know you feel the energy
when you look in my eyes
Can you tell the way
I feel I’m obviously yours to take
Because it’s 4 o’clock
in the morning
And that’s about the time
I start zoning
Thinkin bout all the ways
that I want it
And it's time that you know
you know you know
I’m usually good
at keeping my secrets
But it’s so bad the way
that I need it
If I gave you all my love
would you keep it
Cause it’s time that you know
you know you know
That I can’t stop thinkin bout you
I can't stop thinkin bout you
And I don’t know
what I’m gonna do
I can’t stop thinkin bout you
In my imagination
I can almost feel your touch
Dreaming of the day you
say you want me just as much
But what good are the fantasies
if I don’t get the real thing
Cause although it’s only
in my head for now
I’m hoping once I finally let it out
That you say you
feel the way that I do
Baby say you feel
the way that I do
Because it’s 4 o’clock
in the morning
And that’s about the time
I start zoning
Thinkin bout all the ways
that I want it
And it's time that you know
you know you know
That I can’t stop thinkin bout you
I can't stop thinkin bout you
And I don’t know
what I’m gonna do
I can’t stop thinkin bout you
And I just want you to know
And if you feel the same
then say so
Babe I just want you to know
Baby I just want you to know
you know you know
That I can’t stop thinkin bout you
I can't stop thinkin bout you
And I don’t know
what I’m gonna do
I can’t stop thinkin bout you"
911 (Feat. 잭슨),"1,940",코드 쿤스트 (CODE KUNST),"I’m asking if it’s okay
Turn around for me baby
My heart in your hand is breaking down
You locked me up with your scent
Love that two piece on you girl
Look me in the eyes
cause we’re going down
Too much of you asking why
I do this but know I love you girl
Locking eyes on a rock we smiling
Don’t deny but the feelings true
Tell me tell me girl
Bae you can say it now
know that I need you the most
Cuz, I got you now
Ooh baby
I wanna know, I wanna know tonight
You know that I got you now
Ooh baby
I wanna know, I wanna know tonight
It’s always 3 a.m. you calling
I know you want me just for now
You know I’m down, down
But why is it now now
You always leaving a note
Nah baby
Don’t want you to ask me why
Every night when you call me mine
Tell me if I’m wrong
Saying that night you don’t mind
Even doing nothing killing time
But we know that we wrong
Cuz, I got you now
Ooh baby
I wanna know, I wanna know tonight
You know that I got you now
Ooh baby
I wanna know, I wanna know tonight
I think we know what this about
Don’t let it slip away
The things that we feel deep inside
Will never lie to us
Cuz, I got you now
Ooh baby
I wanna know, I wanna know tonight
You know that I got you now
Ooh baby
I wanna know (I wanna)
I wanna know tonight
(I wanna know tonight)
Cuz, I got you now
Cuz, I got you now
Tell’em I got you now, baby"
Do You Remember Me,114,소울맨,"간절한 마음
오늘 이 밤을 기억해
네게 말할 거야
널 사랑한다고
뒤돌아보니 everyday
내 곁에 있었던
수많은 마음을 나는
알고 있었어
Do you remember me
This heart is always real
때론 나도 모르게
서툰 마음을 비춰도
I'll be next you
And i will sing for you
다 말할 수 없어서
이 내 마음을 노래해

가끔은 두려워
약해진 나의 마음이
혹시 전해질까 날 미워할까 봐
용기 내 네게 말할게
내 곁에 있어줘 um 그대
Please be with me

Do you remember me
This heart is always real
때론 나도 모르게
서툰 마음을 비춰도
I'll be next you
And i will sing for you
다 말할 수 없어서
이 내 마음을 노래해

거친 바람 불어와
우릴 아프게 해도
걱정 마 멀리 가지 않아 난
네 곁에 있을게

Do you remember me
This heart is always real
때론 우리 서로가
서로를 아프게 한데도
I'll be next you
And i will sing for you
다 말할 수 없어도
우리 마음을 바라봐"
이런 밤,"9,535",박화요비,"잠들 수 없는 이런 밤
혼자가 너무 싫어서
바람이라도 들어오도록
작은 창을 모두 열어 놓았어
낡은 피아노 앞에서
즐겨 부르던 노래도
웬지 오늘은 잘 되질 않아
새벽은 더 멀기만 한데
하지만 이대로
그냥 지샐 수 밖에
꼭 이런 날이면 내 꿈 속으로
찾아오는 한 사람이 있을테니
어쩌면 꿈에도
그댈 붙잡지 못한 나
눈물로 또 하룰 보낼테니까
읽다만 책을 펴 봐도
빈 방을 정리해 봐도
내 그리움이 가라앉기엔
이 밤도 다 모자라나봐
내 안에
그대가 없는 날이 없어서
내 맘은 하루도 잠들지 못해
자꾸 외로움에 지쳐가고 있어
차라리 그대를 잊는건
내가 잊어야
슬픔도 날 떠나가 줄지 몰라
내가 그대 곁에
있었다는 것만 기억해
난 그거면 돼
이 밤 어디선가 그대 때문에
잠 못 드는 나를 위해서
하지만 이대로
그냥 지샐 수 밖에
꼭 이런 날이면 내 꿈 속으로
그댄 다시 찾아와 줄테니
어쩌면 꿈에도
그댈 붙잡지 못한 나
눈물로 또 하룰 보낼테니까
눈물로 또 하룰 보낼테니까"
Spell,"15,956",폴킴,"어느새 나도 모르게
니 앞에 있는걸
수줍은 인살 건네
반가운 마음 가득
미소 지으며
How you doing 넌 baby
어색한 공기
더는 견딜 수 없어
제발 아무 말이라도 좀 해
뜨거워지는걸 숨기고 싶어
너에게 이 주문을 걸어봐
baby
그대는 나를 좋아한다
그대는 나를 좋아한다
그대는 나를 좋아해
한걸음 내게 다가와줘
아직 너무 어려워
우린 모르는 게
너무 많잖아
조금씩 너를 더 알아가고 싶어
How you feel bout me baby
입술이 바짝 마르고
심장소리가 커져도
장난처럼 피하지는 마
지금 이 순간
Only a matter of time
또 한번 이 주문을 걸어봐
baby
그대는 나를 좋아한다
그대는 나를 좋아한다
그대는 나를 좋아해
너를 위한 마음에
날 숨겨가며 하는 착한 거짓말
날 나로 만드는 비밀에
주문을 걸어봐
baby
그대는 나를 좋아한다
그대는 나를 좋아한다
그대는 나를 좋아해
그대는 나를 좋아한다
그대는 나를 좋아한다
그대는 나를 좋아해
그대는 나를 좋아한다
그대는 나를 좋아한다
그대는 나를 좋아해"
